{
  "item_id": "f2b3c4d5e6a70819304b5c6d7e8f9a0b1c2d3e4f5a6b7c8d9e0f1a2b3c4d5e6",
  "source_id": "https://example.com/finance/fed-minutes",
  "source_name": "MarketWatch",
  "source_type": "rss",
  "source_url": "https://example.com/finance/fed-minutes",
  "headline": "Fed minutes reveal no urgency to cut rates in Q1 2025",
  "body": "Minutes from the December FOMC meeting showed officials broadly agreed that there was no reason to lower the interest rate until inflation data showed sustained progress toward the 2% target.",
  "topic_candidates": ["finance", "economy"],
  "published_at": "2025-01-15T18:30:00Z",
  "fetched_at": "2025-01-15T18:45:00Z",
  "is_duplicate": false
}
