{
  "item_id": "a9b8c7d6e5f40312837a4b5c6d7e8f9a0b1c2d3e4f5a6b7c8d9e0f1a2b3c4d5",
  "source_id": "https://example.com/ai/open-weight-70b",
  "source_name": "AIInsider",
  "source_type": "rss",
  "source_url": "https://example.com/ai/open-weight-70b",
  "headline": "Major AI lab releases 70B open-weight model under permissive licence",
  "body": "A prominent AI research organisation released a 70-billion parameter language model under an Apache 2.0 licence, enabling unrestricted commercial use.",
  "topic_candidates": ["ai", "technology"],
  "published_at": "2025-01-15T09:30:00Z",
  "fetched_at": "2025-01-15T09:45:00Z",
  "is_duplicate": false
}
